id,career_id,responsibility,display_order
704f0d3a-3f3c-4d39-86b2-3653d931cc62,e5cfe59e-cb50-411b-af02-fba2c1cb4f87,Represents athletes commercially.,1
a47667a8-6cd9-4f7a-8771-409a67e9f2c9,f4ca0ca1-9739-4b36-9f41-6e6ccb332bd2,Analyzes performance using data and video.,1
0b64fab8-78b3-402a-ba3a-710ef7f7b399,67e66e2e-b0ea-43c5-b8a8-6006956e9e9d,Trains athletes and teams.,1
a1bfa393-d195-4f0d-9699-b555c016d071,a6dfb5d3-b52e-4ecd-92dc-02f0156c63c7,Commentates live sports.,1
25b24934-27c0-4dbf-afdf-9815704312fc,2fe6797c-a1ce-410e-b4f8-e838966a3b12,Reports on sports for media.,1
74715e18-2ef3-449a-b817-855ce7424f04,c65da93b-e765-4ee6-b01d-16b2a261b3fb,Designs diets for athletes.,1
6637e08b-ad1d-40dd-abb4-d6cdc096b2e1,0a83861c-3dc1-47cb-b763-b01e894c4714,Treats sports injuries.,1
5ff115d7-8b31-460d-9aa0-6d84f8cd6225,78322c8d-35cf-46f6-b1a0-b8603831603c,Senior IC leading cross-team technical work.,1
0eae4b91-3370-4983-ac2c-5b7058905cd3,0f5f4906-b3a9-46a8-a550-f31b94f7657c,Manages live theater productions.,1
99605a1b-1a51-4b9a-88e2-ee5a1fef96ed,1a400d9e-d2ce-48e9-9574-10f5d3870945,Performs comedy live to audiences.,1
d78db970-420d-4a75-9b9a-31f5e5f08ff1,b88f96ba-efc3-4308-aac1-5f99e7e3870c,Analyzes data using statistical methods.,1
63660494-2f71-4d6f-a853-105412bd6300,94225a29-710b-44a4-9927-820675b52778,Researches stem cell applications.,1
00ddbdbf-4fc1-438c-8887-2fbf0bfc5913,17b8224e-0b2e-46ae-a8e0-26e8003c1c42,Teaches science and tech subjects.,1
938f3afa-6830-4b79-bec1-3f5a0d86fa70,e7a21b36-f4c1-47f1-8aa4-0b21575bb0dc,Creates STEM video content.,1
87fb9b08-36dc-4351-b653-c52fa239b564,21de4c58-9172-4020-b0cf-356580bf9757,Trades stocks for profit.,1
9abc8896-0202-4072-bbd7-2a6570995554,90f020d2-379c-464c-9743-36e200cad95f,Advises executives on growth and competitive strategy.,1
6c7c6c6c-e9be-46d2-8ff2-b947a00775d9,2ea62876-8643-4c9a-be59-39d8c6b7bf4d,Designs structural systems for buildings.,1
6b6a997e-ad3d-40a7-bf2d-1d01d2fc6f3d,42c7477b-2102-40b6-b6a6-87d578e144e7,Manages study abroad programs.,1
acc594b1-b19b-4519-a5d0-7ad648360e3c,4ce1df4a-f5cf-4e49-bd77-decaf7d81792,Serves on submarines.,1
862d0362-7d38-4696-9468-e23551aa0db2,f0885e1a-de16-4bd1-9714-e2e567314986,Supports addiction recovery.,1
0e26106a-ff6d-420a-9249-6b4f8bbfa6d2,e907384b-0a09-47dc-80d5-2289bbb07803,Optimizes flow of goods end-to-end.,1
cd5bec8d-5693-4db2-ab32-352b3646af05,58f4229b-9b18-4132-b6a8-d8714dd361c5,Teaches surfing.,1
bcf194e3-d23a-4922-864f-9aebc73f6c93,3cc46b33-4372-4ed1-a3be-c2c10ce5aa8d,Performs surgical procedures.,1
07b8ef39-b1cf-4175-85df-223fd5b80a02,d99c14e1-1477-4d20-819c-cd3a4c491036,Assists during surgery.,1
77b8f78c-91ef-4fb7-a624-ecbe7c4739b1,073bc8dd-44f2-47c5-b14b-5fb8b16692bd,Measures and maps land for construction.,1
fc29776c-db7d-4205-bd5b-fef2214dc82d,5f22398f-706c-4caf-899a-0d87a5dc2082,Advises on sustainability strategy.,1
0d39352c-b83d-47ae-8220-1ef3c155398e,f80e9aa9-2311-4fd4-91df-8294f531230a,Leads corporate environmental strategy.,1
5dee39df-e8d3-4700-be3b-944d0fdbe63b,2d567333-f291-45ed-b607-595ed73b5cd9,Engineers biological systems.,1
e1bcf762-3feb-4383-98ea-6d7d47b04b0d,9d379fd4-e314-4753-8576-0a437e5a7104,Creates synthetic media content.,1
7b893d57-5b05-4051-8816-ebc9040aff6f,9d984a08-c761-4d07-9e2b-702b3233d0ef,"Maintains servers, OS and IT infrastructure.",1
a37655ea-2930-4be9-bb03-82d389c611f2,2336ab47-1a73-4981-8f86-2fb3419823a0,Builds Tableau analytics.,1
a925ae22-8504-4b13-9dcf-b55c2cf0674d,af4f3357-0efc-4509-86f7-bd33fa9bb048,Custom-makes and alters clothing.,1
45340fbb-8fc9-4ec8-94bf-e72c849542fb,7f938093-db98-4024-bf3f-1d149d898e7b,Leads recruiting strategy and team.,1
d947673a-76e7-419a-8496-b9c2e8e1a87d,9bf8d867-5311-4ebd-a0ae-f0702e630e4e,Provides tarot card readings.,1
01226f27-7e55-4176-84ec-bd4799fb124c,7e3965f1-4cc0-437d-b7ea-7160729e19f2,Creates tattoo art on clients.,1
7c5f175a-e3fe-4290-a006-9cdeb89dbae9,a513de3f-da29-4589-b496-92b63bf53937,Advises clients on tax planning and compliance.,1
ddeb5175-e359-4607-8c96-f476a16dd982,0325c226-1c13-475d-8452-262dcb59bce1,Specializes in tax law and disputes.,1
ac277dc1-c90c-4953-aae7-a231c9ffbe05,613ff985-5d0a-43d6-8d9e-580a9eb150e0,Administers tax collection.,1
aee534cf-577b-47ab-8ced-bcf5693fd7ed,c8eebc3a-dc31-4ee3-a44f-8a00b6867ba8,Expert in tea preparation.,1
e0cd9fd2-0182-48ae-85e8-4390b3b9bfbc,4da09946-a50a-4341-8995-4dbb8654c78c,Manages products with deep technical complexity.,1
0805bd49-2ffa-4db2-8e33-0b08f67ad001,bb79fa74-4b6d-4355-93de-b751fcd0d8bb,Drives complex cross-team technical programs.,1
99fa1dcf-9e58-4daa-8708-af2d14e46b4a,11da153e-aaa1-4d0e-b65a-c578d0e747c1,Recruits engineers and technical talent.,1
7e2094b9-e4ad-4894-a023-4a50fe171b49,e93c159f-4323-4992-82b7-16967ce87472,Documents technical products and systems.,1
3fde1e6c-8d41-4817-810b-59915574ce0a,7e8135ae-bb44-4b4e-8d57-2f2eba4dc2d7,Documents APIs and developer tools.,1
b3314d71-e711-41c8-aaa6-3433dc29f638,ff7ad599-2872-4316-85e4-a71a7bac6062,Manages telehealth platforms.,1
312c6bb7-170e-4ac0-a6ed-81bb9933248a,2a5c03c4-1ce9-4acb-8b13-11db85fc3c5d,Provides healthcare remotely.,1
2a285883-ea31-48ad-8c97-3f94d7fcc1b6,9ae6152a-e428-451b-b562-fd925d98909b,Handles bank counter transactions.,1
ef4754e9-c58d-44f4-bc60-6b0e651b9db7,e790eb93-baba-4845-8d17-c762d0a855e6,Competes in professional tennis.,1
8950ff55-f07f-4dea-8b84-6d2d7a259ed4,7a0d296d-f8fd-42b7-97a1-f7b89f652809,Builds automated test frameworks.,1
1d760edd-24ea-418f-a4a2-b1b9a433f49f,d3c8d261-f4c3-4ccd-9016-a47c84076465,Coaches students for entrance exams.,1
3c858c02-03a8-4f18-bec0-9235cd2af327,757018b7-7558-4d81-8f8d-5dfaef2cc048,Designs textile manufacturing processes.,1
44755a42-115e-4cee-9b15-c6e7be29dc8a,0e2c5577-818c-4206-be75-8503f86044e4,Directs stage productions.,1
dbe84747-0a8c-4777-908f-12b72601ba7f,221fa435-d83d-4b8c-93d4-4512172e23df,Tracks adversary threat actors.,1
e8cb32b1-76db-412d-9027-05e5f269dda6,26172a5c-8511-45bb-817a-23109b7cd3dd,Leads tourists through destinations.,1
862eded4-17fa-47f0-a889-17960459b54f,b5b97c98-1a1a-4276-8507-2ec19bd51afa,Markets tourist destinations.,1
cadaa802-685f-4b2c-be4d-ef340565a52b,77f3c6f8-f72a-4060-9a04-10890d222ec1,Studies harmful effects of chemicals.,1
45331a41-1b77-48af-969e-f8766f50e4c0,c71a6299-741a-41f7-9dc1-dc16501523f6,Operates trains on rail networks.,1
fb445d00-68b8-48b1-8119-6bf0f1599077,7643a716-8962-49f1-b7f1-a38836075ea4,Translates written content between languages.,1
d8bc917c-6712-4e1e-b839-db8fdcd6a74c,cda93c1a-d078-4587-a800-9b21426b1b17,Plans and books travel for clients.,1
cda1b6f2-6fc5-422d-9058-68859c2d79ec,3593e5b9-fe4f-4c73-b78a-90e5a1b65bd2,Creates travel content and reviews.,1
d070c57d-8590-4c93-ab42-dd571358a909,0de538de-a3d9-4618-88e8-5d7e3652fb6f,Works on short-term nursing contracts.,1
faa72597-f144-425c-954a-df7af7bfe072,66a5e5c7-9248-4342-b3bd-a4e89e9b280e,Manages company cash and liquidity.,1
a43dc24c-5d3e-4ea2-b5be-f41545a23f26,981112e4-2685-44f7-a9e0-050b476a5a32,Guides trekking expeditions.,1
a059990b-1aa0-4e69-84c8-636ca86be801,1ba38b52-7443-4bcf-953f-50fc963b8ee3,Transports goods by road.,1
9fcc9b11-f7c5-49af-84b1-2a801bd30ca9,9a6b4038-c681-449f-bc38-31b30d887afe,Manages trust and safety operations.,1
1914d0fb-6a9a-4acc-99eb-87f9aa23ce6c,05255b66-80c0-4ca5-a8b7-031ff6c3426d,Crafts visual interfaces for apps and websites.,1
d7fde59a-2035-44a3-9907-07b04797560c,fa24ff68-e7d3-427a-b054-7cb6efdef182,Works in United Nations organizations.,1
fa5c3edd-69b3-4d74-8d3d-210eafb6c0b0,61d52661-9045-438b-8cbf-458cc11daac6,Builds games and 3D apps in Unity.,1
bb0f0064-2d04-42db-aec7-5a99a15d3718,191f9bcf-c74f-4b5e-975a-ae7abe57f8f4,Builds with Unreal Engine.,1
ff461c20-c060-4888-a4b0-50b82b4b6c1f,56413fda-38a7-43e0-b269-b511e741b6d4,Designs cities and public spaces.,1
29f0734e-c0ee-4606-8db9-b38850ba6b96,48012c55-1403-45b5-9ddf-1910bcdb4d7c,Plans the use and development of land in cities.,1
a76303ef-cefa-4169-a957-196ac5b0ecbe,1a30ba69-c763-4090-b816-02eec0d3aa68,Designs user experiences,1
6f7bbbaf-0d29-491b-a0f5-62bf95eec1f6,12237ee4-7429-4513-908d-963bf9b6412b,Conducts user research to inform product decisions.,1
709b483b-71e3-4725-bbf5-6d45622d102d,54014ea1-1f4a-4774-bc74-4900c1c51229,Develops vaccines.,1
6aaef703-ac97-4030-a32c-72c987174845,2c47e52a-d85c-4049-ac61-02bf7cb6ff9c,Invests in early-stage startups.,1
2ac51787-9b38-4fda-b7c5-247f728eb2fa,4de3c27a-4e7b-4e86-9c66-26eef36e7289,Designs vertical farms.,1
4d252288-c0ed-48ac-8098-321432662eb8,9de18cca-404a-40c7-bf14-686f40eda6a3,Provides medical care to animals.,1
b373931a-27bd-4cc4-ab0d-82ff5f9880f7,8c2f84f6-7064-45de-b977-100493dc482f,Supports veterinarians.,1
0b7619f1-7495-4d69-93c6-e58722c3ce1f,2c2b4a12-8886-415a-bb5f-1e4c46545673,Creates visual effects for film and media.,1
e3fe731c-3b8c-495b-84ac-956e356c3d25,361436f2-930b-4b06-a08d-773b893a7702,Captures video for events and productions.,1
d28a698e-d3e2-422f-bc6e-90caee0c91f4,6c212d50-e06a-4f65-88e8-917c76df5b3e,Provides remote administrative support.,1
802b8f13-794b-47e8-a2dd-168e29a14ed9,24c9e1ef-bd9c-41d5-85bf-b8344e72bff5,Designs in-store visual displays.,1
225a2bae-d28e-40ab-8975-105eaf25d8b3,bf5893fa-7956-4762-b828-c1764e4c8a61,Provides voices for animation and ads.,1
4f610c08-3941-441f-b87f-dba60e4de62e,bca03e78-c723-4653-9bd1-1bf68927ae94,Designs voice user experiences.,1
fba1c0d9-006a-41c0-84f0-17663d3572ce,b0a80f4c-0252-45d3-bc76-af25e0e85751,Optimizes content for voice search.,1
19e49f71-11a6-4634-9f51-a0307d72aa40,d24d8e3d-d506-43bf-a910-fcb2efd08388,Studies volcanoes.,1
e2fb33cb-624b-41de-bd51-e5b917ae961b,d5dd7dcc-7af4-497c-9e61-785010917b74,Builds Vue-based frontends.,1
249e4fd3-b29e-4217-9c26-6c52e374f2ee,9e9ba0be-5f18-4924-823d-cdb09fa91c21,Runs warehouse operations.,1
1b917be7-39f8-4c5a-8942-fb3a43ce2e44,69b8125b-663e-43e4-bdc8-bab5a3998978,Manages waste systems.,1
4aaecd40-4469-4b01-88ed-d6f0d09b08a9,e1b04267-50c8-431c-974d-f4c584f02c47,Builds and repairs watches.,1
593d1ff8-fd96-4f22-91e5-5de8d3626343,20cd9603-e3e3-4aa5-b92c-743026c98a12,Manages water systems.,1
5e469004-7c9a-4a78-bd86-1ea05611e325,830f980a-1a2f-4e52-9f14-5bdbbe508364,Manages investments for high-net-worth clients.,1
8f22bd97-e647-435f-9fa7-6669269cac67,686ec4b5-4150-4c1c-b50f-a26f6d73437e,Builds wearable devices.,1
fccd76a6-23b2-42dd-8dd9-300935c08b98,cda9c07f-d384-4f7a-b5e9-2c17c4d599d7,Manages decentralized products.,1
1a085e08-d363-40bc-a3d7-0043dbd2e819,16de9503-c49d-40da-b679-2c35c2ca463b,Specializes in wedding event planning.,1
fb3d4a12-ce7e-424b-bb07-9de815a9dbf6,d662f0c6-0dc1-4896-b166-dc94fe182d14,Joins metal parts using heat.,1
f58a56cf-daee-4778-87d6-3ba9409ebcfe,02609f40-38f4-49c6-b503-ac6c9dda53c1,Inspects welds for quality.,1
51004aa2-7413-4a94-ae08-bd8ec000f016,3698d33c-8f73-4203-a84d-dbbaddb90b6f,Provides therapy in wilderness settings.,1
8e98e53a-d839-402f-97f6-79b61f61e974,f48b3033-5c1d-49e9-bc8e-de070e50ca61,Studies wildlife in natural habitats.,1
5ffc1957-7641-4e82-a8fd-56166bf7a5b7,5222bf2b-0d7e-4365-9d72-1b50e00f8211,Maintains wind power systems.,1
f431a71f-6b7d-4d16-9f58-33b00c8bb09c,33429ecb-715c-4f9f-9518-5beae4112f32,Facilitates workshops and trainings.,1
bd75fb7d-ae36-4e53-bfaf-34cd68614382,0534ceb5-13bd-45fd-9e96-3a980312ee22,Teaches yoga to students.,1
c915991a-3de8-4b39-a11f-b01d16a91102,eec7edc1-be8b-4918-89b4-38f7f4925825,Uses yoga for therapeutic treatment.,1
95a726a3-b844-4605-abe3-3b389952eff7,73144b8c-d69c-4709-b21e-b133274bee28,Creates and monetizes video content.,1
70fb976d-d301-4479-a571-1e9f0201bc60,df66682b-c95f-4468-a48c-61a4905de577,Builds ZK cryptography systems.,1
e05f5c6d-c4d5-4054-a2c2-9fdc9d4ae4e7,df4fed6d-d7f7-4d46-b18a-165129b0d10d,Cares for animals in zoos.,1
c8f82f1d-48f5-458a-8ef3-4fbdd6a37143,52b7cf39-a13e-4666-809a-613d2e71df95,Studies animal biology and behavior.,1
